{
  "$schema": "https://json-schema.org/draft/2020-12/schema",
  "$id": "https://github.com/eligreenmac/betaflight-setup-wizard/schemas/drone-model.schema.json",
  "title": "DroneModel",
  "description": "Firmware-version-independent description of what is connected to the flight controller. Produced by the wizard UI, consumed by the config engine. Mirrors src-tauri/src/model.rs and src/types/model.ts.",
  "type": "object",
  "required": ["schemaVersion", "fc", "receiver", "vtx", "gps", "esc"],
  "additionalProperties": false,
  "$defs": {
    "portName": {
      "description": "FC serial port name as reported by config_read_ports. SOFTSERIAL1/2 are valid names but the MVP config engine rejects them (no soft serial in MVP).",
      "type": ["string", "null"],
      "pattern": "^(UART([1-9]|1[0-5])|LPUART1|SOFTSERIAL[12])$"
    },
    "vtxTable": {
      "description": "Betaflight vtxtable; limits from drivers/vtx_table.h (same on 4.4/4.5/2025.12).",
      "type": "object",
      "required": ["bands", "powerLevels"],
      "additionalProperties": false,
      "properties": {
        "bands": {
          "type": "array", "maxItems": 8,
          "items": {
            "type": "object",
            "required": ["name", "letter", "factory", "frequencies"],
            "additionalProperties": false,
            "properties": {
              "name": { "type": "string", "minLength": 1, "maxLength": 8 },
              "letter": { "type": "string", "minLength": 1, "maxLength": 1 },
              "factory": { "type": "boolean" },
              "frequencies": { "type": "array", "maxItems": 8, "items": { "type": "integer", "minimum": 0, "maximum": 5999 } }
            }
          }
        },
        "powerLevels": {
          "type": "array", "maxItems": 8,
          "items": {
            "type": "object",
            "required": ["value", "label"],
            "additionalProperties": false,
            "properties": {
              "value": { "type": "integer", "minimum": 0, "maximum": 65535 },
              "label": { "type": "string", "minLength": 1, "maxLength": 3 }
            }
          }
        }
      }
    },
    "elrsDomain": {
      "description": "expresslrs_domain (betaflight cli/settings.c lookupTableFreqDomain). SX1280 builds: ISM2400, CE2400; SX127x builds: the sub-GHz values.",
      "enum": [null, "AU433", "AU915", "EU433", "EU868", "IN866", "FCC915", "ISM2400", "CE2400"]
    }
  },
  "properties": {
    "schemaVersion": { "const": 1 },
    "fc": {
      "type": "object",
      "required": ["boardName", "firmwareVersion", "apiVersion"],
      "additionalProperties": false,
      "properties": {
        "boardName": { "type": "string", "examples": ["SPEEDYBEEF405V4"] },
        "firmwareVersion": { "type": "string", "examples": ["4.5.2", "2025.12.1"],
                             "description": "Config engine accepts 4.4.x, 4.5.x and 2025.12.x only; anything else (incl. 2026.6.x) fails with UNSUPPORTED_FIRMWARE." },
        "apiVersion": { "type": "string", "examples": ["1.46"] }
      }
    },
    "receiver": {
      "description": "SERIAL (UART, feature RX_SERIAL) and SPI (onboard receiver, feature RX_SPI, no UART) are mutually exclusive; switching clears the other. MVP config engine supports NONE, SERIAL and SPI+EXPRESSLRS.",
      "type": "object",
      "required": ["kind"],
      "additionalProperties": false,
      "properties": {
        "kind": { "enum": ["NONE", "SERIAL", "SPI", "PPM", "MSP"] },
        "protocol": {
          "enum": [null, "CRSF", "GHST", "SBUS", "FPORT", "IBUS", "SRXL2", "SPEK1024", "SPEK2048", "SUMD",
                   "EXPRESSLRS", "FRSKY_D", "FRSKY_X", "FRSKY_X_LBT"]
        },
        "port": { "$ref": "#/$defs/portName" },
        "telemetry": { "type": "boolean", "default": true,
                       "description": "CRSF, FPORT, SPI EXPRESSLRS: true enables feature TELEMETRY. Other protocols: ignored (feature left untouched)." },
        "inverted": { "type": "boolean", "default": false },
        "halfDuplex": { "type": "boolean", "default": false },
        "elrsUid": { "type": ["array", "null"], "items": { "type": "integer", "minimum": 0, "maximum": 255 },
                     "minItems": 6, "maxItems": 6,
                     "description": "SPI EXPRESSLRS only. The 6-byte ExpressLRS UID written as expresslrs_uid; null keeps the current UID. The UI derives it from the user's binding phrase with config_elrs_uid (first 6 bytes of MD5('-DMY_BINDING_PHRASE=\"<phrase>\"')) and then discards the phrase. The binding phrase is never part of the model and is never stored or logged." },
        "elrsDomain": { "$ref": "#/$defs/elrsDomain" }
      },
      "allOf": [
        { "if": { "properties": { "kind": { "const": "SERIAL" } } },
          "then": { "required": ["protocol", "port"], "properties": { "port": { "type": "string" } } } },
        { "if": { "properties": { "kind": { "const": "SPI" } } },
          "then": { "required": ["protocol"], "properties": { "port": { "type": "null" } } } }
      ]
    },
    "vtx": {
      "type": "object",
      "required": ["kind"],
      "additionalProperties": false,
      "properties": {
        "kind": { "enum": ["NONE", "ANALOG", "DIGITAL"] },
        "protocol": { "enum": [null, "SMARTAUDIO", "TRAMP", "MSP"] },
        "port": { "$ref": "#/$defs/portName" },
        "digitalSystem": { "enum": [null, "DJI", "WALKSNAIL", "HDZERO", "OTHER"] },
        "region": { "type": ["string", "null"], "pattern": "^[A-Z]{2}$",
                    "description": "ISO-3166 alpha-2; the UI picks a table preset from it, the generator only writes table" },
        "table": { "oneOf": [{ "type": "null" }, { "$ref": "#/$defs/vtxTable" }], "description": "vtxtable; null = keep the FC's table" },
        "band": { "type": ["integer", "null"], "minimum": 1, "maximum": 8, "description": "vtx_band, 1-based into table; null = keep" },
        "channel": { "type": ["integer", "null"], "minimum": 1, "maximum": 8, "description": "vtx_channel, 1-based; null = keep" },
        "power": { "type": ["integer", "null"], "minimum": 1, "maximum": 7, "description": "vtx_power, 1-based into powerLevels (0 = unknown is not written); the CLI range is 0..VTX_TABLE_MAX_POWER_LEVELS-1, so 1-7 even though a table may list 8 levels; null = keep" }
      }
    },
    "gps": {
      "type": "object",
      "required": ["enabled"],
      "additionalProperties": false,
      "properties": {
        "enabled": { "type": "boolean" },
        "port": { "$ref": "#/$defs/portName" },
        "provider": { "enum": [null, "UBLOX", "NMEA"] },
        "galileo": { "type": ["boolean", "null"],
                     "description": "UBLOX only: gps_ublox_use_galileo. GLONASS/BeiDou are not configurable in 4.4-2025.12; null = keep" },
        "sbasMode": { "enum": [null, "AUTO", "EGNOS", "WAAS", "MSAS", "GAGAN", "NONE"], "description": "gps_sbas_mode; null = keep" }
      }
    },
    "esc": {
      "type": "object",
      "required": ["protocol"],
      "additionalProperties": false,
      "properties": {
        "protocol": { "enum": ["DSHOT150", "DSHOT300", "DSHOT600", "ONESHOT125", "MULTISHOT", "PWM"] },
        "bidirectionalDshot": { "type": "boolean", "default": false },
        "motorPoles": { "type": ["integer", "null"], "minimum": 4, "maximum": 64 },
        "telemetryPort": { "$ref": "#/$defs/portName" },
        "propsOut": { "type": "boolean", "default": false,
                      "description": "yaw_motors_reversed. Per-motor DShot spin-direction reversal is phase 2 (not in the schema)." },
        "idle": { "type": ["integer", "null"], "minimum": 0, "maximum": 2000,
                  "description": "0.01 % units (550 = 5.5 %): dshot_idle_value (4.4/4.5) / motor_idle (2025.12); null = keep" },
        "motorOrder": { "type": ["array", "null"], "minItems": 4, "maxItems": 8, "uniqueItems": true,
                        "items": { "type": "integer", "minimum": 0, "maximum": 7 },
                        "description": "motor_output_reordering: item i = 0-based output for motor i+1, a permutation of 0..n; null = keep" }
      }
    },
    "switches": {
      "type": "array",
      "items": {
        "type": "object",
        "required": ["mode", "auxChannel", "rangeMin", "rangeMax"],
        "additionalProperties": false,
        "properties": {
          "mode": { "type": "string", "examples": ["ARM", "ANGLE", "BEEPER"] },
          "auxChannel": { "type": "integer", "minimum": 0, "maximum": 13 },
          "rangeMin": { "type": "integer", "minimum": 900, "maximum": 2100, "multipleOf": 25 },
          "rangeMax": { "type": "integer", "minimum": 900, "maximum": 2100, "multipleOf": 25 }
        }
      }
    },
    "extras": {
      "type": "object",
      "additionalProperties": false,
      "properties": {
        "beeper": { "type": ["boolean", "null"] },
        "ledStrip": { "type": ["boolean", "null"] },
        "craftName": { "type": ["string", "null"], "maxLength": 16, "pattern": "^(?:[\\x21\\x22\\x24-\\x2C\\x2E-\\x3E\\x40-\\x7E]|[\\x21\\x22\\x24-\\x3E\\x40-\\x7E][\\x20-\\x22\\x24-\\x3E\\x40-\\x7E]{0,14}[\\x21\\x22\\x24-\\x3E\\x40-\\x7E])?$",
                       "description": "set craft_name (Betaflight CLI rules, 4.4/4.5/2025.12): 1-16 chars of printable ASCII 0x20-0x7E except # (CLI comment) and ? (interactive CLI help), no leading/trailing space (the CLI strips them), not exactly - (the CLI's empty marker); an empty string clears it (written as -); null = keep" }
      }
    }
  },
  "examples": [
    {
      "schemaVersion": 1,
      "fc": { "boardName": "SPEEDYBEEF405V4", "firmwareVersion": "4.5.2", "apiVersion": "1.46" },
      "receiver": { "kind": "SERIAL", "protocol": "CRSF", "port": "UART2", "telemetry": true },
      "vtx": { "kind": "DIGITAL", "protocol": "MSP", "port": "UART1", "digitalSystem": "DJI" },
      "gps": { "enabled": true, "port": "UART4", "provider": "UBLOX" },
      "esc": { "protocol": "DSHOT600", "bidirectionalDshot": true, "motorPoles": 14, "propsOut": true },
      "switches": [{ "mode": "ARM", "auxChannel": 0, "rangeMin": 1800, "rangeMax": 2100 }],
      "extras": { "craftName": "QUAD" }
    },
    {
      "schemaVersion": 1,
      "fc": { "boardName": "CRAZYBEEF4SX1280", "firmwareVersion": "4.5.2", "apiVersion": "1.46" },
      "receiver": { "kind": "SPI", "protocol": "EXPRESSLRS", "port": null, "telemetry": true,
                    "elrsUid": [30, 182, 235, 65, 136, 241], "elrsDomain": "ISM2400" },
      "vtx": { "kind": "NONE" },
      "gps": { "enabled": false },
      "esc": { "protocol": "DSHOT300", "bidirectionalDshot": true, "motorPoles": 12 },
      "switches": [{ "mode": "ARM", "auxChannel": 0, "rangeMin": 1700, "rangeMax": 2100 }]
    }
  ]
}
